{
  "report_version": "1.0.0",
  "project_slug": "ui_observability",
  "result": "passed",
  "started_at_utc": "2026-03-08T00:00:00Z",
  "finished_at_utc": "2026-03-08T00:03:20Z",
  "applied_sequences": [
    1,
    2
  ],
  "findings": [],
  "archived_files": [
    "_processed/zip1_ui_observability_core.zip",
    "_processed/zip2_ui_observability_rules_reporting.zip"
  ]
}